{
  "schema_version": "daid_bazel_bep_artifact_created_request_v1",
  "claim_id": "claim-bep-summary-supported",
  "source": {
    "format": "bazel-build-event-protocol-json",
    "version": "8.7.0",
    "sha256": "6e7ff7dd3108d4d922fbdc621ce836331f69d468782b2c6f9dd3814b1fcd7406"
  },
  "selection": {
    "build_uuid": "11111111-2222-3333-4444-555555555555",
    "target_label": "//reports:summary",
    "configuration_id": "cfg-k8-fastbuild",
    "output_group": "default",
    "artifact": {
      "label": "summary-output",
      "path_prefix": ["bazel-out", "k8-fastbuild", "bin", "reports"],
      "name": "summary.json",
      "digest": "aaaaaaaaaaaaaaaaaaaaaaaaaaaaaaaaaaaaaaaaaaaaaaaaaaaaaaaaaaaaaaaa",
      "length": "184"
    }
  }
}
