{
  "schema_version": "daid_bazel_bep_artifact_created_request_v1",
  "claim_id": "claim-bep-summary-contradicted",
  "source": {
    "format": "bazel-build-event-protocol-json",
    "version": "8.7.0",
    "sha256": "51f2f2d029b0b5e501b6a659a625a025a2fbb16958e94b5ed9749f3e535d5822"
  },
  "selection": {
    "build_uuid": "11111111-2222-3333-4444-555555555555",
    "target_label": "//reports:summary",
    "configuration_id": "cfg-k8-fastbuild",
    "output_group": "default",
    "artifact": {
      "label": "summary-output",
      "path_prefix": ["bazel-out", "k8-fastbuild", "bin", "reports"],
      "name": "summary.json",
      "digest": "aaaaaaaaaaaaaaaaaaaaaaaaaaaaaaaaaaaaaaaaaaaaaaaaaaaaaaaaaaaaaaaa",
      "length": "184"
    }
  }
}
